{
  "schema_version": 2,
  "bundle_format": "aidlc-mission-bundle/v2",
  "mission_id": "mission-20260812-0001",
  "mission_slug": "human-first-evidence",
  "mission_sha256": "aaaaaaaaaaaaaaaaaaaaaaaaaaaaaaaaaaaaaaaaaaaaaaaaaaaaaaaaaaaaaaaa",
  "created_at": "2026-08-12T18:45:28Z",
  "host_run_ref": "run-0001",
  "projection_ref": "MISSION.md",
  "mission_ref": ".aidlc/mission.json",
  "event_log_ref": ".aidlc/events.jsonl",
  "outcome_ref": ".aidlc/latest-outcome.json",
  "review_root_ref": ".aidlc/reviews"
}
